{
  "$schema": "https://json-schema.org/draft/2020-12/schema",
  "$id": "https://credflow.local/contracts/events/event-envelope.schema.json",
  "title": "CredFlow event envelope 1.0",
  "type": "object",
  "properties": {
    "eventId": {
      "type": "string",
      "format": "uuid"
    },
    "eventType": {
      "type": "string",
      "minLength": 1
    },
    "schemaVersion": {
      "const": "1.0"
    },
    "occurredAt": {
      "type": "string",
      "format": "date-time"
    },
    "producer": {
      "type": "string",
      "minLength": 1
    },
    "applicationId": {
      "type": "string",
      "format": "uuid"
    },
    "aggregateVersion": {
      "type": "integer",
      "minimum": 1
    },
    "correlationId": {
      "type": "string",
      "pattern": "^[A-Za-z0-9._:-]{1,100}$"
    },
    "causationId": {
      "type": "string",
      "format": "uuid"
    },
    "data": {
      "type": "object"
    },
    "actor": {
      "type": "object",
      "properties": {
        "type": {
          "enum": [
            "HUMAN",
            "SYSTEM",
            "SYSTEM_CLIENT"
          ]
        },
        "subject": {
          "type": "string",
          "minLength": 1,
          "maxLength": 255
        },
        "organisationId": {
          "type": "string",
          "format": "uuid"
        }
      },
      "required": [
        "type",
        "subject"
      ],
      "additionalProperties": false
    },
    "originActor": {
      "type": "object",
      "properties": {
        "type": {
          "enum": [
            "HUMAN",
            "SYSTEM",
            "SYSTEM_CLIENT"
          ]
        },
        "subject": {
          "type": "string",
          "minLength": 1,
          "maxLength": 255
        },
        "organisationId": {
          "type": "string",
          "format": "uuid"
        }
      },
      "required": [
        "type",
        "subject"
      ],
      "additionalProperties": false
    }
  },
  "required": [
    "eventId",
    "eventType",
    "schemaVersion",
    "occurredAt",
    "producer",
    "applicationId",
    "aggregateVersion",
    "correlationId",
    "data",
    "actor"
  ],
  "additionalProperties": false,
  "$comment": "Absent optional fields are omitted; null is not an alternate UUID or actor value. Each per-topic schema constrains data."
}