{
  "eventId": "85586df4-45c5-5d17-9d98-ab7760c6f34b",
  "eventType": "lender.processing.recovered",
  "schemaVersion": "1.0",
  "occurredAt": "2026-10-16T09:00:00Z",
  "producer": "lender-integration-service",
  "applicationId": "52de19d2-1bea-5fd3-9685-868e1a7207b7",
  "aggregateVersion": 1,
  "correlationId": "demo-flow-bank-a-104",
  "data": {
    "submissionId": "147ef5e6-266b-5f82-bbf5-a34183361fc4",
    "applicationRevision": 1,
    "lenderId": "bbbbbbbb-bbbb-4bbb-8bbb-bbbbbbbbbbb1",
    "lenderApplicationId": "BA-147ef5e6-266b-5f82-bbf5-a34183361fc4",
    "taskId": "b03dc4fb-70bb-5c70-be63-46d2d9d20ab6",
    "operation": "CREATE_OFFER",
    "offerId": "5c149b12-3116-5cd5-bb69-71e241f95f0f"
  },
  "actor": {
    "type": "SYSTEM_CLIENT",
    "subject": "lender-integration-service"
  },
  "originActor": {
    "type": "HUMAN",
    "subject": "seller-demo-104"
  }
}
