{
  "eventId": "f1ec0037-930c-5f8d-8f29-d7354532c753",
  "eventType": "verification.completed",
  "schemaVersion": "1.0",
  "occurredAt": "2026-10-16T09:00:00Z",
  "producer": "consent-verification-service",
  "applicationId": "52de19d2-1bea-5fd3-9685-868e1a7207b7",
  "aggregateVersion": 1,
  "correlationId": "demo-flow-bank-a-104",
  "data": {
    "verificationId": "f2e0a9b4-794d-5340-9b34-5a1fd1153469",
    "applicationRevision": 1,
    "status": "VERIFIED",
    "checkedAt": "2026-10-16T09:00:00Z",
    "fixtureIdentityId": "DEMO-VERIFIED-001",
    "authorisedRetrievalReference": "demo-authorised-source-104"
  },
  "actor": {
    "type": "SYSTEM_CLIENT",
    "subject": "consent-verification-service"
  },
  "originActor": {
    "type": "HUMAN",
    "subject": "seller-demo-104"
  }
}
