{
  "eventId": "fa5bba7a-6eb6-5141-8094-07d4ad5dc9ef",
  "eventType": "lender.decision.received",
  "schemaVersion": "1.0",
  "occurredAt": "2026-10-16T09:00:00Z",
  "producer": "lender-integration-service",
  "applicationId": "52de19d2-1bea-5fd3-9685-868e1a7207b7",
  "aggregateVersion": 1,
  "correlationId": "demo-flow-bank-a-104",
  "data": {
    "submissionId": "147ef5e6-266b-5f82-bbf5-a34183361fc4",
    "applicationRevision": 1,
    "lenderId": "bbbbbbbb-bbbb-4bbb-8bbb-bbbbbbbbbbb1",
    "lenderApplicationId": "BA-147ef5e6-266b-5f82-bbf5-a34183361fc4",
    "decisionId": "5bd24c77-72c8-5a79-8788-651b0ba6dcb5",
    "decision": "APPROVED",
    "decidedAt": "2026-10-16T09:00:00Z"
  },
  "actor": {
    "type": "SYSTEM_CLIENT",
    "subject": "lender-integration-service"
  },
  "originActor": {
    "type": "HUMAN",
    "subject": "seller-demo-104"
  }
}
