{
  "eventId": "22e0ce9e-3e42-5488-b683-d844dbe1ad5f",
  "eventType": "loan.offer.created",
  "schemaVersion": "1.0",
  "occurredAt": "2026-10-16T09:00:00Z",
  "producer": "lender-integration-service",
  "applicationId": "52de19d2-1bea-5fd3-9685-868e1a7207b7",
  "aggregateVersion": 1,
  "correlationId": "demo-flow-bank-a-104",
  "data": {
    "submissionId": "147ef5e6-266b-5f82-bbf5-a34183361fc4",
    "applicationRevision": 1,
    "lenderId": "bbbbbbbb-bbbb-4bbb-8bbb-bbbbbbbbbbb1",
    "lenderApplicationId": "BA-147ef5e6-266b-5f82-bbf5-a34183361fc4",
    "offerId": "5c149b12-3116-5cd5-bb69-71e241f95f0f",
    "offeredAmount": "500000.00",
    "currency": "INR",
    "annualInterestRatePercent": "12.5",
    "interestRateType": "FIXED",
    "tenureMonths": 24,
    "repaymentFrequency": "MONTHLY",
    "feesAmount": "2500.00",
    "termsReference": "synthetic://terms/bank-a-v1",
    "expiresAt": "2026-11-16T09:00:00Z",
    "version": 0,
    "status": "ACTIVE"
  },
  "actor": {
    "type": "SYSTEM_CLIENT",
    "subject": "lender-integration-service"
  },
  "originActor": {
    "type": "HUMAN",
    "subject": "seller-demo-104"
  }
}
