{
  "eventId": "311fc854-288d-587a-b537-d2be686687b6",
  "eventType": "loan.offer.expired",
  "schemaVersion": "1.0",
  "occurredAt": "2026-10-16T09:00:00Z",
  "producer": "orchestration-service",
  "applicationId": "52de19d2-1bea-5fd3-9685-868e1a7207b7",
  "aggregateVersion": 1,
  "correlationId": "demo-flow-bank-a-104",
  "data": {
    "offerId": "5c149b12-3116-5cd5-bb69-71e241f95f0f",
    "submissionId": "147ef5e6-266b-5f82-bbf5-a34183361fc4"
  },
  "actor": {
    "type": "SYSTEM_CLIENT",
    "subject": "orchestration-service"
  },
  "originActor": {
    "type": "HUMAN",
    "subject": "seller-demo-104"
  }
}
