{
  "eventId": "9addb5ce-72ea-5807-b95d-13c9f194ea45",
  "eventType": "lender.information.response.recorded",
  "schemaVersion": "1.0",
  "occurredAt": "2026-10-16T09:00:00Z",
  "producer": "orchestration-service",
  "applicationId": "52de19d2-1bea-5fd3-9685-868e1a7207b7",
  "aggregateVersion": 1,
  "correlationId": "demo-flow-bank-a-104",
  "data": {
    "informationRequestId": "6e3a445a-b737-53db-8726-85db6021d620",
    "submissionId": "147ef5e6-266b-5f82-bbf5-a34183361fc4"
  },
  "actor": {
    "type": "HUMAN",
    "subject": "seller-demo-104"
  },
  "originActor": {
    "type": "HUMAN",
    "subject": "seller-demo-104"
  }
}
